{
  "contract_version": "runtime-overlay-observation-v1",
  "schema_version": "2",
  "run_id": "데모-001:overlay:정비-001",
  "sequence": 1,
  "asset_id": "CNC-가공-01",
  "equipment_id": "CNC-가공-01",
  "observed_at": "2026-08-18T01:40:00+00:00",
  "generated_at": "2026-08-18T02:00:00+00:00",
  "measurements": {
    "air_temperature_k": 301.8953,
    "process_temperature_k": 310.7953,
    "rotational_speed_rpm": 1406.628,
    "torque_nm": 51.3807,
    "tool_wear_min": 0.0,
    "is_operating": 1,
    "operating_state": "가동중",
    "product_type": "가공"
  },
  "generator_version": "canonical-ai4i-physics-v3.1",
  "asset_type": "cnc",
  "site_id": "공장-01",
  "cell_id": "셀-01",
  "source_kind": "maintenance_replay_overlay",
  "observation_id": "obs-e3614a66b6ebdd68b42e67c2272266c0",
  "observation_sha256": "9e847b16a7485d26f1bdf75c65e6b9211a8440647b9b2a23c099d2cc005df913",
  "observed_at_source": "source",
  "branch_kind": "overlay",
  "overlay": {
    "overlay_id": "정비-001:post",
    "parent_branch": "canonical",
    "maintenance_event_id": "정비-001",
    "state_patch_reference": "작업-001",
    "simulation_session_id": "데모-001",
    "history_segment_id": "정비-001:post",
    "state_version": 3
  },
  "record_kind": "full_observation",
  "quality": "good",
  "base_dataset_version": "predictive-maintenance-canonical-v3.1",
  "base_source_sha256": "2222222222222222222222222222222222222222222222222222222222222222",
  "simulation_session_id": "데모-001",
  "overlay_branch_id": "정비-001:post",
  "maintenance_event_id": "정비-001",
  "maintenance_action_id": "작업-001",
  "state_version": 3,
  "history_segment_id": "정비-001:post",
  "air_temperature_k": 301.8953,
  "process_temperature_k": 310.7953,
  "rotational_speed_rpm": 1406.628,
  "torque_nm": 51.3807,
  "tool_wear_min": 0.0,
  "is_operating": 1,
  "operating_state": "가동중",
  "product_type": "가공"
}
